[{"id":173735,"parent":159347,"superparent":9,"author":214,"type":"item","subtype":"game","subsubtype":"jam","published":"2019-10-07T22:55:18Z","created":"2019-10-07T22:41:54Z","modified":"2019-10-08T15:50:03Z","version":523169,"slug":"research-station-3152","name":"Research Station 3152","body":"You are an AI in control of an abandoned Research Station. Defend it at all costs.\n\nHOW TO PLAY\n\nUse the mouse to move around the view and grab the drones / fuel blobs.\nOffline drones (hover and it will tell you) require fuel to start. Fuel and more drones periodically spawn.\nSome pirates will appear, you must defend your station by holding the drones in place and moving them around. \nSome of them take their time to arrive, space is big!\n\nKEYS\n\nLeft mouse button - Grab objects (hold down the button)\n\nEsc - open pause menu\n\n![2019-10-08_01-53-32 Game.png](ludum-dare/45/research-station-3152/images/2852a.png)","meta":{"author":[214],"cover":"///content/6d/z/28547.png","link-01":"https://github.com/bradur/LD45/releases/download/entry/Ludum.Dare.-.Research.Station.3152.-.Windows.zip","link-01-tag":"42337","link-02":"https://bradur.github.io/LD45/","link-02-tag":"42336"},"path":"/events/ludum-dare/45/research-station-3152","parents":[1,5,9,159347],"love":0,"notes":1,"notes-timestamp":"2019-10-08T10:27:29Z","grade":{"grade-01":2,"grade-02":2,"grade-03":2,"grade-04":2,"grade-05":2,"grade-06":2,"grade-07":1,"grade-08":2},"magic":{"cool":0,"feedback":0,"given":0,"grade":1.875,"smart":-26.970325665978},"eventName":"Ludum Dare 45","cover":"ludum-dare/45/research-station-3152/images/28547.png","url":"games/ludum-dare/45/research-station-3152","links":[{"url":"https://ldjam.com/events/ludum-dare/45/research-station-3152","title":"LDJam page"},{"url":"https://github.com/bradur/LD45/releases/download/entry/Ludum.Dare.-.Research.Station.3152.-.Windows.zip","title":"Microsoft Windows"},{"url":"https://bradur.github.io/LD45/","title":"HTML5 (web)"}],"comments":[{"id":391345,"parent":0,"node":173735,"supernode":159347,"author":96152,"created":"2019-10-08T10:27:29Z","modified":"2019-10-08T10:27:29Z","version":434790,"flags":0,"body":"Cool but there appears to be only one wave.","love":0,"timestamp":"10/8/2019, 12:27:29","ago":"7 months ago"}],"event":{"id":159347,"parent":9,"superparent":5,"author":11,"type":"event","subtype":"ld","subsubtype":"","published":"2019-08-25T21:26:43Z","created":"2019-08-25T21:20:04Z","modified":"2019-10-03T17:48:59Z","version":488004,"slug":"45","name":"Ludum Dare 45","body":"Join us for Ludum Dare **45**, our first October Ludum Dare, also a new time (3 hours earlier than usual).\n\nFollow the **[/news](/news)** for the latest updates on the event.\n\n* :closed_book: **Rules**: [/ludum-dare/rules](/events/ludum-dare/rules)\n* :green_book: **Game Hosting Guide**: [/ludum-dare/hosting-guide](/events/ludum-dare/hosting-guide)\n* :globe_with_meridians: **Real World Gatherings**: [/real-world-gatherings-for-ludum-dare-45](https://ldjam.com/events/ludum-dare/45/$159348/real-world-gatherings-for-ludum-dare-45)\n* :tv: **Keynote**: [by KP](/events/ludum-dare/45/$159348/welcome-to-ludum-dare-45-dont-forget-we-start-early)\n","meta":{"can-grade":"0","can-publish":"1","can-theme":"1","event-finished":"1","event-theme":"Start with nothing","theme-mode":"8","theme-idea-limit":"3","event-start":"2019-10-04T22:00:00Z","event-end":"2019-10-07T22:00:00Z","theme-page-mode-1":"2","theme-page-mode-2":"2","theme-page-mode-3":"2","theme-page-mode-4":"2","theme-page-name-4":"Final Round","event-group-slug-1":"jam","event-group-name-1":"Jam","event-group-closed-1":"0","event-group-slug-2":"compo","event-group-name-2":"Compo","event-group-closed-2":"0","grade-01":"Overall","grade-02":"Fun","grade-03":"Innovation","grade-04":"Theme","grade-05":"Graphics","grade-05-optional":"1","grade-06":"Audio","grade-06-optional":"1","grade-07":"Humor","grade-07-optional":"1","grade-08":"Mood","grade-08-optional":"1"},"path":"/events/ludum-dare/45","parents":[1,5,9],"love":0,"timestamp":"8/25/2019, 23:26:43","ago":"8 months ago"},"results":[{"title":"Overall","average":"-","result":"-"},{"title":"Fun","average":"-","result":"-"},{"title":"Innovation","average":"-","result":"-"},{"title":"Theme","average":"-","result":"-"},{"title":"Graphics","average":"-","result":"-"},{"title":"Audio","average":"-","result":"-"},{"title":"Humor","average":"-","result":"-"},{"title":"Mood","average":"-","result":"-"}],"released":"2019.10.08 01:55:18","timestamp":"10/8/2019, 00:55:18","ago":"7 months ago","coverColors":{"colors":[[22,22,47,255],[31,98,221,255],[183,188,199,255],[49,146,249,255],[104,74,97,255]],"css":"--one: rgba(22,22,47,255);--two: rgba(31,98,221,255);--three: rgba(183,188,199,255);--four: rgba(49,146,249,255);--five: rgba(104,74,97,255);"}},{"id":149712,"parent":139254,"superparent":9,"author":214,"type":"item","subtype":"game","subsubtype":"compo","published":"2019-04-28T20:47:33Z","created":"2019-04-27T07:36:46Z","modified":"2019-04-28T20:47:33Z","version":442214,"slug":"pay-with-your-blood","name":"Pay With Your Blood","body":"# Pay With Your Blood\n\n## Gameplay\nMission: Kill all enemies.\nBuy weapons from shop. Pay with your blood!\n\n## Keys\n| Key(s)              | Action           |\n| --------------------|:----------------:|\n| Arrows / WASD       | Move             | \n| Spacebar / LMB      | Shoot            |\n| Mouse               | Aim              |\n| Numbers / Scroll    | Switch weapon    |\n| Esc                 | Open pause menu  |\n\n\n![2019-04-28_23-42-20 Unity WebGL Player _ Pay With Your Blood.png](ludum-dare/44/pay-with-your-blood/images/2119e.png)\n\n![2019-04-28_23-42-32 Unity WebGL Player _ Pay With Your Blood.png](ludum-dare/44/pay-with-your-blood/images/2119f.png)\n\n\n\n\n\n","meta":{"author":[214],"cover":"///content/6d/z/2119d.png","allow-anonymous-comments":"1","link-01":"https://bradur.github.io//LD44/","link-01-tag":"42336","link-02":"https://github.com/bradur/LD44","link-02-tag":"42332"},"path":"/events/ludum-dare/44/pay-with-your-blood","parents":[1,5,9,139254],"love":0,"notes":13,"notes-timestamp":"2019-05-07T12:01:49Z","grade":{"grade-01":23,"grade-02":23,"grade-03":23,"grade-04":23,"grade-05":23,"grade-06":22,"grade-07":21,"grade-08":23},"magic":{"cool":101.43479354265,"feedback":18,"given":22.25,"grade":22.625,"grade-01-average":3.167,"grade-01-result":343,"grade-02-average":2.929,"grade-02-result":359,"grade-03-average":2.619,"grade-03-result":420,"grade-04-average":3.81,"grade-04-result":65,"grade-05-average":2.571,"grade-05-result":446,"grade-06-average":3.05,"grade-06-result":233,"grade-07-average":2.184,"grade-07-result":351,"grade-08-average":2.881,"grade-08-result":334,"smart":17.525123680567},"eventName":"Ludum Dare 44","cover":"ludum-dare/44/pay-with-your-blood/images/2119d.png","url":"games/ludum-dare/44/pay-with-your-blood","links":[{"url":"https://ldjam.com/events/ludum-dare/44/pay-with-your-blood","title":"LDJam page"},{"url":"https://bradur.github.io//LD44/","title":"HTML5 (web)"},{"url":"https://github.com/bradur/LD44","title":"Source Code"}],"comments":[{"id":336265,"parent":0,"node":149712,"supernode":139254,"author":173,"created":"2019-04-30T08:05:57Z","modified":"2019-04-30T08:05:57Z","version":374308,"flags":0,"body":"Great retro action game! Nice difficulty, didn't finish all the levels on first try but I didn't get frustrated either. I like the tile graphics, nice and clean. The shadow is a nice touch as well. At first it felt really bad that up is up with mouse aiming. I would have prefered strafing and going forward. After a while I did learn to play with the controls, so it's not a big deal I guess. I feel like the best start on the first level was just spam the bat. I couldn't figure out how to dodge and time my hits. Maybe it's just me. I played this on macbook with touchpad. It runs well, but I couldn't switch my weapons. I seemed to do fine with just one weapon / level anyway. All in all, great game. Great music and sfx! :D","love":0,"timestamp":"4/30/2019, 10:05:57","ago":"a year ago"},{"id":359152,"parent":0,"node":149712,"supernode":139254,"author":145214,"created":"2019-05-03T15:25:57Z","modified":"2019-05-03T15:25:57Z","version":399342,"flags":0,"body":"Really fun!","love":0,"timestamp":"5/3/2019, 17:25:57","ago":"a year ago"},{"id":359174,"parent":0,"node":149712,"supernode":139254,"author":141173,"created":"2019-05-03T15:34:26Z","modified":"2019-05-03T15:34:26Z","version":399369,"flags":0,"body":"I really like the shooting mechanics as well as the different weapons as having multiple weapons really adds depth to the game! I think maybe the shotgun should maybe have done less damage over range, but that's not an issue whatsoever! Overall, this is a really good jam entry!","love":0,"timestamp":"5/3/2019, 17:34:26","ago":"a year ago"},{"id":361630,"parent":0,"node":149712,"supernode":139254,"author":4280,"created":"2019-05-04T13:13:47Z","modified":"2019-05-04T13:13:47Z","version":402087,"flags":0,"body":"Wow, very nice Hotline Miami homage, top-down action and a cool tune as well :-)\n\nOf course the enemy movement could have been a little more sophisticated ;-)\n\nIt is a nice little game, the graphics are fine for a Ludum Dare game. Funny programmer art. The music is very cool.","love":0,"timestamp":"5/4/2019, 15:13:47","ago":"a year ago"},{"id":361651,"parent":0,"node":149712,"supernode":139254,"author":55003,"created":"2019-05-04T13:25:16Z","modified":"2019-05-04T13:25:16Z","version":402112,"flags":0,"body":"Music is amazing, gameplay and sfx as well. Really well done. Only thing I would recommend is to make the player just a little bit bigger in relation to the level. Usually I don't really like top down shooters but this was actually fun! Well done!","love":0,"timestamp":"5/4/2019, 15:25:16","ago":"a year ago"},{"id":361689,"parent":0,"node":149712,"supernode":139254,"author":362,"created":"2019-05-04T13:45:00Z","modified":"2019-05-04T13:45:00Z","version":402153,"flags":0,"body":"Cool game! I like how every level is a bit of a puzzle - which weapon to buy and how much ammo.\nThe club feels a bit off in the beginning but the guns are pretty snappy and explosives are always fun.\n\nSome more ways to lure enemies into traps / distract them would be an interesting addition.\n\nThe music was also pretty nice - I was sad when the shop music was stopped when starting a level :stuck_out_tongue: \n","love":0,"timestamp":"5/4/2019, 15:45:00","ago":"a year ago"},{"id":362420,"parent":0,"node":149712,"supernode":139254,"author":142976,"created":"2019-05-04T19:25:14Z","modified":"2019-05-04T19:25:14Z","version":402954,"flags":0,"body":"Really nice. Fun little top down game. I feel like the graphics are a bit inconsistent but Iâ€™m always picky with graphics :P ","love":0,"timestamp":"5/4/2019, 21:25:14","ago":"a year ago"},{"id":363499,"parent":0,"node":149712,"supernode":139254,"author":9980,"created":"2019-05-05T06:39:29Z","modified":"2019-05-05T06:39:29Z","version":404147,"flags":0,"body":"Solid music and sounds. I like the way that you integrated the theme into the gameplay in a really thoughtful manner. If you continue work on this I'd love to see more enemy behaviors! Could really spice things up!","love":0,"timestamp":"5/5/2019, 08:39:29","ago":"a year ago"},{"id":363521,"parent":0,"node":149712,"supernode":139254,"author":1087,"created":"2019-05-05T07:07:26Z","modified":"2019-05-05T07:07:26Z","version":404169,"flags":0,"body":"Nice game. The music was good. Good job!","love":0,"timestamp":"5/5/2019, 09:07:26","ago":"a year ago"},{"id":363543,"parent":0,"node":149712,"supernode":139254,"author":39436,"created":"2019-05-05T07:26:54Z","modified":"2019-05-05T07:26:54Z","version":404194,"flags":0,"body":"I like the music and art, they fit together well. The movement was smooth and I liked the mouse aiming. The enemy AI was pretty good and I definitely approve of having multiple types of enemies in a level. The sound effects were also on point.\n\nUnfortunately there was a pretty big bug for me on both Firefox and Chrome - I couldn't switch weapons at all and would get stuck with an empty gun and killed. I'd say the basic club weapon should maybe have some changes so I can win fights by skill instead of just trading damage for damage. \n\nAlso there was this pretty funny bug here - the enemies can push you outside of the level:\n\n![chrome_2019-05-05_00-06-39.png](ludum-dare/44/pay-with-your-blood/images/249ec.png)","love":0,"timestamp":"5/5/2019, 09:26:54","ago":"a year ago"},{"id":363904,"parent":0,"node":149712,"supernode":139254,"author":126840,"created":"2019-05-05T12:11:42Z","modified":"2019-05-05T12:11:42Z","version":404591,"flags":0,"body":"I like the music. The gameplay is ok, but the enemy's AI often gets stuck. The C4 sometimes glitches and flies through the room stopping at the first wall. Overall I think it's nice but glitchy.","love":0,"timestamp":"5/5/2019, 14:11:42","ago":"a year ago"},{"id":366871,"parent":0,"node":149712,"supernode":139254,"author":143181,"created":"2019-05-07T11:24:57Z","modified":"2019-05-07T11:24:57Z","version":407868,"flags":0,"body":"Fits the theme as proper and makes for a decent, yet sometimes a buggy top down shooter which i like for the fact that gives options of what i can use each level!\n\nGreat job!","love":0,"timestamp":"5/7/2019, 13:24:57","ago":"a year ago"},{"id":366901,"parent":0,"node":149712,"supernode":139254,"author":35556,"created":"2019-05-07T12:01:49Z","modified":"2019-05-07T12:01:49Z","version":407902,"flags":0,"body":"the character is too slow which makes the fight slow and rigid.","love":0,"timestamp":"5/7/2019, 14:01:49","ago":"a year ago"}],"event":{"id":139254,"parent":9,"superparent":5,"author":11,"type":"event","subtype":"ld","subsubtype":"","published":"2019-03-08T05:49:54Z","created":"2019-03-08T05:36:59Z","modified":"2019-04-25T02:22:34Z","version":427295,"slug":"44","name":"Ludum Dare 44","body":"Join us for Ludum Dare **44**, our first event of 2019!\n\nFollow the **[/news](/news)** for the latest updates on the event.\n\n* :closed_book: **Rules**: [/ludum-dare/rules](/events/ludum-dare/rules)\n* :green_book: **Game Hosting Guide**: [/ludum-dare/hosting-guide](/events/ludum-dare/hosting-guide)\n* :tv: **Keynote**: [/ludum-dare/44/.../welcome-to-ludum-dare-44](/events/ludum-dare/44/$139255/welcome-to-ludum-dare-44)\n\n* :frame_photo: **Wallpapers**: [/ludum-dare/44/.../wallpaper-thread](/events/ludum-dare/44/$140885/ludum-dare-44-wallpaper-thread)\n* :earth_americas: **Real World Gatherings**: [/ludum-dare/44/.../real-worlds-gatherings](/events/ludum-dare/44/$140885/ludum-dare-44-real-worlds-gathering-thread)\n* :joystick: **Dare to Play**: [/events/ludum-dare/44/.../dare-to-play](/events/ludum-dare/44/$140885/ludum-dare-44-dare-to-play-thread)\n","meta":{"can-grade":"0","can-publish":"0","can-theme":"1","event-finished":"1","event-theme":"Your life is currency","theme-mode":"8","theme-idea-limit":"3","event-start":"2019-04-27T01:00:00Z","event-end":"2019-04-30T01:00:00Z","theme-page-mode-1":"2","theme-page-mode-2":"2","theme-page-mode-3":"2","theme-page-mode-4":"2","theme-page-name-4":"Final Round","event-group-slug-1":"jam","event-group-name-1":"Jam","event-group-closed-1":"1","event-group-slug-2":"compo","event-group-name-2":"Compo","event-group-closed-2":"1","grade-01":"Overall","grade-02":"Fun","grade-03":"Innovation","grade-04":"Theme","grade-05":"Graphics","grade-05-optional":"1","grade-06":"Audio","grade-06-optional":"1","grade-07":"Humor","grade-07-optional":"1","grade-08":"Mood","grade-08-optional":"1"},"path":"/events/ludum-dare/44","parents":[1,5,9],"love":0,"timestamp":"3/8/2019, 07:49:54","ago":"a year ago"},"results":[{"title":"Overall","average":3.167,"result":343},{"title":"Fun","average":2.929,"result":359},{"title":"Innovation","average":2.619,"result":420},{"title":"Theme","average":3.81,"result":65},{"title":"Graphics","average":2.571,"result":446},{"title":"Audio","average":3.05,"result":233},{"title":"Humor","average":2.184,"result":351},{"title":"Mood","average":2.881,"result":334}],"released":"2019.04.28 11:47:33","timestamp":"4/28/2019, 22:47:33","ago":"a year ago","coverColors":{"colors":[[71,63,39,255],[248,214,144,255],[204,124,100,255],[244,4,16,255],[132,108,68,255]],"css":"--one: rgba(71,63,39,255);--two: rgba(248,214,144,255);--three: rgba(204,124,100,255);--four: rgba(244,4,16,255);--five: rgba(132,108,68,255);"}},{"id":127774,"parent":120415,"superparent":9,"author":214,"type":"item","subtype":"game","subsubtype":"compo","published":"2018-12-03T00:31:52Z","created":"2018-11-30T19:16:38Z","modified":"2018-12-03T00:31:52Z","version":383802,"slug":"not-safe-for-teamwork","name":"Not Safe for Teamwork","body":"# Not Safe for Teamwork\n\n## Gameplay\nControl multiple characters, complete puzzles, reach level end. Sacrifice some characters.\n\n## Keys\n| Key(s)              | Action           |\n| --------------------|:----------------:|\n| Arrows              | Move             | \n| Spacebar            | Interact         |\n| 1, 2, 3, 4, 5 / Tab | Switch character |\n| Esc / P             | Open pause menu  |\nNo mouse controls.\n\n## Story\n\n*Corporate has sent you and your coworkers to a team-building exercise. You must complete tricky puzzles together, using your individual strengths and weaknesses to overcome challenges. Sometimes, in order to go forward, you have to leave your colleagues behind...*\n\n![first.png](ludum-dare/43/not-safe-for-teamwork/images/1c26f.png)\n\n\n\n\n\n","meta":{"author":[214],"cover":"///content/6d/z/1c26d.png","allow-anonymous-comments":"1","link-01":"https://github.com/bradur/LD43","link-01-tag":"42332","link-02":"https://bradur.github.io/LD43/","link-02-tag":"42336","link-03":"https://github.com/bradur/LD43/releases/download/CompoRelease/Ludum.Dare.43.-.Not.Safe.for.Teamwork.-.Windows.zip","link-03-tag":"42337","link-04":"https://github.com/bradur/LD43/releases/download/CompoRelease/Ludum.Dare.43.-.Not.Safe.for.Teamwork.-.Mac.OSX.zip","link-04-tag":"42339","link-05":"https://github.com/bradur/LD43/releases/download/CompoRelease/Ludum.Dare.43.-.Not.Safe.for.Teamwork.-.Linux.zip","link-05-tag":"42341"},"path":"/events/ludum-dare/43/not-safe-for-teamwork","parents":[1,5,9,120415],"love":0,"notes":17,"notes-timestamp":"2018-12-07T18:09:07Z","grade":{"grade-01":22,"grade-02":22,"grade-03":22,"grade-04":22,"grade-05":22,"grade-06":21,"grade-07":22,"grade-08":22},"magic":{"cool":108.33525255478,"feedback":14,"given":24.5,"grade":21.875,"grade-01-average":3.525,"grade-01-result":198,"grade-02-average":3.55,"grade-02-result":136,"grade-03-average":3.4,"grade-03-result":164,"grade-04-average":4.075,"grade-04-result":62,"grade-05-average":2.925,"grade-05-result":355,"grade-06-average":2.947,"grade-06-result":258,"grade-07-average":2.825,"grade-07-result":226,"grade-08-average":2.9,"grade-08-result":337,"smart":18.651642595047},"eventName":"Ludum Dare 43","cover":"ludum-dare/43/not-safe-for-teamwork/images/1c26d.png","url":"games/ludum-dare/43/not-safe-for-teamwork","links":[{"url":"https://ldjam.com/events/ludum-dare/43/not-safe-for-teamwork","title":"LDJam page"},{"url":"https://github.com/bradur/LD43","title":"Source Code"},{"url":"https://bradur.github.io/LD43/","title":"HTML5 (web)"},{"url":"https://github.com/bradur/LD43/releases/download/CompoRelease/Ludum.Dare.43.-.Not.Safe.for.Teamwork.-.Windows.zip","title":"Microsoft Windows"},{"url":"https://github.com/bradur/LD43/releases/download/CompoRelease/Ludum.Dare.43.-.Not.Safe.for.Teamwork.-.Mac.OSX.zip","title":"Apple macOS"},{"url":"https://github.com/bradur/LD43/releases/download/CompoRelease/Ludum.Dare.43.-.Not.Safe.for.Teamwork.-.Linux.zip","title":"Linux"}],"comments":[{"id":281826,"parent":0,"node":127774,"supernode":120415,"author":76102,"created":"2018-12-03T09:48:06Z","modified":"2018-12-03T09:48:06Z","version":314692,"flags":0,"body":"Enjoyable little puzzler! Fits the theme well, and I didn't encounter any bugs! A really nice level of challenge as it took a few goes to pass most levels. Well done!","love":1,"love-timestamp":"2018-12-03T09:48:09Z","timestamp":"12/3/2018, 11:48:06","ago":"a year ago"},{"id":281850,"parent":0,"node":127774,"supernode":120415,"author":120786,"created":"2018-12-03T09:54:01Z","modified":"2018-12-03T09:54:01Z","version":314718,"flags":0,"body":"very well done puzzles, and the sacrifice is cool! ","love":0,"timestamp":"12/3/2018, 11:54:01","ago":"a year ago"},{"id":282149,"parent":0,"node":127774,"supernode":120415,"author":123995,"created":"2018-12-03T11:09:21Z","modified":"2018-12-03T11:09:21Z","version":315043,"flags":0,"body":"Simple designed puzzle game, nice.","love":0,"timestamp":"12/3/2018, 13:09:21","ago":"a year ago"},{"id":282154,"parent":0,"node":127774,"supernode":120415,"author":120072,"created":"2018-12-03T11:11:19Z","modified":"2018-12-03T11:11:19Z","version":315049,"flags":0,"body":"Nice puzzle game, it reminds of Chip's challenge and the likes just with more characters. Puzzles are well designed and visual + audio style goes well together with the gameplay. Sometimes I wish I had an overview over the map so it's not trial and error. Overall, I liked it :)","love":0,"timestamp":"12/3/2018, 13:11:19","ago":"a year ago"},{"id":286007,"parent":0,"node":127774,"supernode":120415,"author":17869,"created":"2018-12-03T22:58:51Z","modified":"2018-12-03T22:58:51Z","version":319288,"flags":0,"body":"Really solid game you've got here. Could use a minimap or a better camera, but had a fun time with it!","love":0,"timestamp":"12/4/2018, 00:58:51","ago":"a year ago"},{"id":298980,"parent":0,"node":127774,"supernode":120415,"author":13726,"created":"2018-12-05T06:41:31Z","modified":"2018-12-05T06:41:31Z","version":333381,"flags":0,"body":"Really felt like I was sacrificing team mates...  I was always hesitant to flip the switch! Great work, very complete and satisfying effort.","love":0,"timestamp":"12/5/2018, 08:41:31","ago":"a year ago"},{"id":299204,"parent":0,"node":127774,"supernode":120415,"author":2401,"created":"2018-12-05T07:55:51Z","modified":"2018-12-05T07:55:51Z","version":333623,"flags":0,"body":"Wow, this was a surprisingly well put-together puzzle game. The last level really had me stumped for a while (I almost thought maybe you'd accidentally made the game unbeatable for a good 5 minutes or so)! That music just goes so well with the theme of the game, and the theme of the game goes so well with the theme of the jam.\n\nI'm playing this because you submitted it to be a part of my Play & Improve series, but I'm honestly having difficulty thinking of what I'd even do. The only usability problem that bugged me was that I had to press 'P' before 'R' to restart! Other than that, it's really the graphics that need the most improvement and I'm a terrible artist. I don't think you need a minimap or a better camera - there was only one place where I couldn't see what I needed (bottom of the last level). I'm not great at designing puzzles and you've already got some great levels in here. I'm stumped! Is there anything you wish you could have done that I could take a stab at? If not, I'll think more on it...","love":0,"timestamp":"12/5/2018, 09:55:51","ago":"a year ago"},{"id":304003,"parent":0,"node":127774,"supernode":120415,"author":58592,"created":"2018-12-06T00:56:34Z","modified":"2018-12-06T00:56:34Z","version":338814,"flags":0,"body":"Its like SAW (the movie) somehow ... sacrificing mates to continue to the other chambers of the game ... nice puzzles in this","love":0,"timestamp":"12/6/2018, 02:56:34","ago":"a year ago"},{"id":305312,"parent":0,"node":127774,"supernode":120415,"author":562,"created":"2018-12-06T09:54:54Z","modified":"2018-12-06T09:54:54Z","version":340221,"flags":0,"body":"Neat game! I included it in my compilation video series of games from the Ludum Dare, if youâ€™d like to take a look :) https://youtu.be/8gcHVPkzZQo","love":0,"timestamp":"12/6/2018, 11:54:54","ago":"a year ago"},{"id":305468,"parent":0,"node":127774,"supernode":120415,"author":126274,"created":"2018-12-06T10:40:09Z","modified":"2018-12-06T10:40:09Z","version":340387,"flags":0,"body":"Fun game, reminds me a lot of portal's co op. Music fits this really well, it feels like some sort of elevator music, very calm anyway. Level design is cool too, but sometimes i'd like to see all the characters at the same time, because sometimes the levels are so large, that when switching characters, i don't know where i am anymore. Great work!","love":0,"timestamp":"12/6/2018, 12:40:09","ago":"a year ago"},{"id":305531,"parent":0,"node":127774,"supernode":120415,"author":72322,"created":"2018-12-06T11:17:52Z","modified":"2018-12-06T11:17:52Z","version":340471,"flags":0,"body":"Challenging level design, great puzzles.","love":0,"timestamp":"12/6/2018, 13:17:52","ago":"a year ago"},{"id":305568,"parent":0,"node":127774,"supernode":120415,"author":129895,"created":"2018-12-06T11:33:18Z","modified":"2018-12-06T11:33:18Z","version":340509,"flags":0,"body":"Cool puzzle game, maybe add a view where you can see the entire level? Some of the larger levels it became quite hard to orientate yourself when switching characters. Also the movement was a little wonky and I think it could be improved to be more precise. Overall decent puzzles, some that were actually quite a challenge. Cool concept. Well done!","love":0,"timestamp":"12/6/2018, 13:33:18","ago":"a year ago"},{"id":305592,"parent":0,"node":127774,"supernode":120415,"author":23990,"created":"2018-12-06T11:46:50Z","modified":"2018-12-06T11:46:50Z","version":340535,"flags":0,"body":"Hi there,\n\nThese are great puzzles!\nThank you for this nice game!\n\none remark:\n* puzzle 2 & 3 are actually the same solution so it was not that engaging. I'm happy I tried the levels after that anyway because they were again fun to solve!\nIf you enjoy puzzles like this definitely try our game as well!","love":0,"timestamp":"12/6/2018, 13:46:50","ago":"a year ago"},{"id":306361,"parent":0,"node":127774,"supernode":120415,"author":6887,"created":"2018-12-06T15:58:20Z","modified":"2018-12-06T15:58:20Z","version":341372,"flags":0,"body":"Interesting! Always a fan of a nice puzzle game. The concept was a bit brutal for my tastes, but the puzzles were nice in a Chip's Challenge -esque way. Very solid!","love":0,"timestamp":"12/6/2018, 17:58:20","ago":"a year ago"},{"id":308067,"parent":0,"node":127774,"supernode":120415,"author":34254,"created":"2018-12-07T01:01:12Z","modified":"2018-12-07T01:01:12Z","version":343227,"flags":0,"body":"I enjoyed this thoroughly, well designed puzzles and well implemented.  ","love":0,"timestamp":"12/7/2018, 03:01:12","ago":"a year ago"},{"id":308123,"parent":0,"node":127774,"supernode":120415,"author":3095,"created":"2018-12-07T01:40:24Z","modified":"2018-12-07T01:40:24Z","version":343285,"flags":0,"body":"Well done puzzles! I'm also terribly amused by the idea of a corporate team building exercise resulting in the death of some of the employees.","love":0,"timestamp":"12/7/2018, 03:40:24","ago":"a year ago"},{"id":309666,"parent":0,"node":127774,"supernode":120415,"author":56406,"created":"2018-12-07T18:09:07Z","modified":"2018-12-07T18:09:07Z","version":344964,"flags":0,"body":"Great puzzles, very original take on the theme","love":0,"timestamp":"12/7/2018, 20:09:07","ago":"a year ago"}],"event":{"id":120415,"parent":9,"superparent":5,"author":11,"type":"event","subtype":"ld","subsubtype":"","published":"2018-11-05T12:33:13Z","created":"2018-11-05T12:33:13Z","modified":"2018-12-01T02:18:53Z","version":372989,"slug":"43","name":"Ludum Dare 43","body":"Join us for Ludum Dare **43**, the last of our December events (starting next year come back every [April and October](https://ldjam.com/events/ludum-dare/42/placeholder/results-for-ludum-dare-42)).\n\nFollow the **[/news](/news)** for the latest updates on the event.\n\n* :closed_book: **Rules**: [/ludum-dare/rules](/events/ludum-dare/rules)\n* :green_book: **Game Hosting Guide**: [/ludum-dare/hosting-guide](/events/ludum-dare/hosting-guide)\n* :tv: **Keynote**: [/events/ludum-dare/43/.../welcome-to-ludum-dare-43](/events/ludum-dare/43/$120416/welcome-to-ludum-dare-43)\n","meta":{"can-grade":"0","can-publish":"1","can-theme":"1","event-finished":"1","event-theme":"Sacrifices must be made","theme-mode":"8","theme-idea-limit":"3","event-start":"2018-12-01T02:00:00Z","event-end":"2018-12-04T02:00:00Z","theme-page-mode-1":"2","theme-page-mode-2":"2","theme-page-mode-3":"2","theme-page-mode-4":"2","theme-page-name-4":"Final Round","event-group-closed-1":"1","event-group-closed-2":"1","event-group-name-1":"Jam","event-group-name-2":"Compo","event-group-slug-1":"jam","event-group-slug-2":"compo","grade-01":"Overall","grade-02":"Fun","grade-03":"Innovation","grade-04":"Theme","grade-05":"Graphics","grade-05-optional":"1","grade-06":"Audio","grade-06-optional":"1","grade-07":"Humor","grade-07-optional":"1","grade-08":"Mood","grade-08-optional":"1"},"path":"/events/ludum-dare/43","parents":[1,5,9],"love":0,"timestamp":"11/5/2018, 14:33:13","ago":"a year ago"},"results":[{"title":"Overall","average":3.525,"result":198},{"title":"Fun","average":3.55,"result":136},{"title":"Innovation","average":3.4,"result":164},{"title":"Theme","average":4.075,"result":62},{"title":"Graphics","average":2.925,"result":355},{"title":"Audio","average":2.947,"result":258},{"title":"Humor","average":2.825,"result":226},{"title":"Mood","average":2.9,"result":337}],"released":"2018.12.03 02:31:52","timestamp":"12/3/2018, 02:31:52","ago":"a year ago","coverColors":{"colors":[[192,183,169,255],[42,89,113,255],[111,146,48,255],[124,126,125,255],[109,78,49,255]],"css":"--one: rgba(192,183,169,255);--two: rgba(42,89,113,255);--three: rgba(111,146,48,255);--four: rgba(124,126,125,255);--five: rgba(109,78,49,255);"}},{"id":106779,"parent":97793,"superparent":9,"author":214,"type":"item","subtype":"game","subsubtype":"compo","published":"2018-08-12T21:44:37Z","created":"2018-08-10T16:44:08Z","modified":"2018-08-14T05:49:03Z","version":338777,"slug":"slime-janitor","name":"Slime Janitor","body":"# Took out the WebGL build since it was way too buggy.\n\n![2018-08-13_00-31-38 Slime Janitor.png](ludum-dare/42/slime-janitor/images/16837.png)\n\nPrevent the slime from taking over the world. Blow it up!\n\n\n## About the builds:\n- Best working build is Windows.\n- Works best in 16:9 resolution from 1280x720 onwards.\n- Linux & Mac builds NOT tested.\n\n\n## Keys\n| Key(s)            | Action        |\n| ----------------- |:-------------:|\n| Arrows            | Move          | \n| Spacebar          | Use tool      |\n| 1, 2, 3           | Switch tools  |\n| Esc               | Pause         |\n| M                 | Mute music    |\nNo mouse controls.\n\n![2018-08-13_00-26-42 Slime Janitor.png](ludum-dare/42/slime-janitor/images/16832.png)\n\n![2018-08-13_00-26-01 Slime Janitor.png](ludum-dare/42/slime-janitor/images/16835.png)\n\n\n","meta":{"author":[214],"cover":"///content/6d/z/167a1.png","grade-07-out":"1","allow-anonymous-comments":"1","link-01":"https://github.com/bradur/LD42","link-01-tag":"50","link-02":"https://github.com/bradur/LD42/releases/download/entry/Ludum.Dare.Slime.Janitor.windows.zip","link-02-tag":"42337","link-03":"https://github.com/bradur/LD42/releases/download/entry/Ludum.Dare.Slime.Janitor.mac.app.zip","link-03-tag":"42339","link-04":"https://github.com/bradur/LD42/releases/download/entry/Ludum.Dare.Slime.Janitor.linux.zip","link-04-tag":"42341","link-05":"","link-05-tag":"0"},"path":"/events/ludum-dare/42/slime-janitor","parents":[1,5,9,97793],"love":0,"notes":17,"notes-timestamp":"2018-09-02T18:41:06Z","grade":{"grade-01":25,"grade-02":25,"grade-03":25,"grade-04":25,"grade-05":25,"grade-06":25,"grade-08":25},"magic":{"cool":109.70837772801,"feedback":17,"given":25.125,"grade":25,"grade-01-average":3.587,"grade-01-result":226,"grade-02-average":3.543,"grade-02-result":195,"grade-03-average":3.522,"grade-03-result":183,"grade-04-average":3.739,"grade-04-result":272,"grade-05-average":2.913,"grade-05-result":499,"grade-06-average":3.413,"grade-06-result":156,"grade-08-average":3.522,"grade-08-result":117,"smart":15.974135047432},"eventName":"Ludum Dare 42","cover":"ludum-dare/42/slime-janitor/images/167a1.png","url":"games/ludum-dare/42/slime-janitor","links":[{"url":"https://ldjam.com/events/ludum-dare/42/slime-janitor","title":"LDJam page"},{"url":"https://github.com/bradur/LD42","title":"Source"},{"url":"https://github.com/bradur/LD42/releases/download/entry/Ludum.Dare.Slime.Janitor.windows.zip","title":"Microsoft Windows"},{"url":"https://github.com/bradur/LD42/releases/download/entry/Ludum.Dare.Slime.Janitor.mac.app.zip","title":"Apple macOS"},{"url":"https://github.com/bradur/LD42/releases/download/entry/Ludum.Dare.Slime.Janitor.linux.zip","title":"Linux"}],"comments":[{"id":214164,"parent":0,"node":106779,"supernode":97793,"author":97006,"created":"2018-08-12T22:34:32Z","modified":"2018-08-12T22:34:32Z","version":240159,"flags":0,"body":"Nice, fun little game. But yeah, seems like there's an issue with sound for the web version. Wish it had more levels but you were short on time so I'll give a pass for that. ","love":0,"timestamp":"8/13/2018, 00:34:32","ago":"2 years ago"},{"id":216821,"parent":0,"node":106779,"supernode":97793,"author":111247,"created":"2018-08-13T04:54:08Z","modified":"2018-08-13T04:54:08Z","version":243024,"flags":0,"body":"Took me a moment to find the controls, but it played well and was fun - well done :)","love":0,"timestamp":"8/13/2018, 06:54:08","ago":"2 years ago"},{"id":268657,"parent":0,"node":106779,"supernode":97793,"author":87266,"created":"2018-08-24T16:31:01Z","modified":"2018-08-24T16:31:01Z","version":300275,"flags":0,"body":"Very nice. The UI is a little tiny on a 4K display, but other than that, the game works great. Slime janitoring appears to be a rather dangerous occupation to have! I like it a lot, especially the way that replaying levels gets you to instinctively \"speedrun\" them in order to save yourself the most amount of trouble. The background music is also quite nice to see. Good job!  \n  \nThe only \"con\" I can think of is that I wish diagonal movement was a thing... :)","love":0,"timestamp":"8/24/2018, 18:31:01","ago":"2 years ago"},{"id":271187,"parent":0,"node":106779,"supernode":97793,"author":104805,"created":"2018-08-28T12:40:57Z","modified":"2018-08-28T12:40:57Z","version":303053,"flags":0,"body":"NVIDIA CEO: \"With new realtime ray tracing technology we are able to render ideal wall shadows\"\nbradur: \"Hold my beer\"\n\nof course 10/10 \n","love":0,"timestamp":"8/28/2018, 14:40:57","ago":"2 years ago"},{"id":273397,"parent":0,"node":106779,"supernode":97793,"author":1708,"created":"2018-09-01T06:46:59Z","modified":"2018-09-01T06:46:59Z","version":305471,"flags":0,"body":"Well made and interesting gameplay. I like the extra time you spent on making the menus look good. I think the next step would be to polish the graphics some.","love":0,"timestamp":"9/1/2018, 08:46:59","ago":"2 years ago"},{"id":273418,"parent":0,"node":106779,"supernode":97793,"author":97456,"created":"2018-09-01T08:00:05Z","modified":"2018-09-01T08:00:06Z","version":305493,"flags":0,"body":"It's a very good idea, but unfortunately I couldn't get past level 2 as the game crashes when the dynamite explodes (macOS).","love":0,"timestamp":"9/1/2018, 10:00:05","ago":"2 years ago"},{"id":273573,"parent":0,"node":106779,"supernode":97793,"author":77230,"created":"2018-09-01T15:51:42Z","modified":"2018-09-01T15:51:42Z","version":305658,"flags":0,"body":"Those shadows look amazing, i like the designs of the stages, they are quite challenging, well done!","love":0,"timestamp":"9/1/2018, 17:51:42","ago":"2 years ago"},{"id":273591,"parent":0,"node":106779,"supernode":97793,"author":59203,"created":"2018-09-01T16:20:26Z","modified":"2018-09-01T16:20:26Z","version":305676,"flags":0,"body":"liked the puzzle design of the game but this got frustrating quick!","love":0,"timestamp":"9/1/2018, 18:20:26","ago":"2 years ago"},{"id":273604,"parent":0,"node":106779,"supernode":97793,"author":36518,"created":"2018-09-01T16:39:15Z","modified":"2018-09-01T16:39:15Z","version":305689,"flags":0,"body":"Hey I really enjoyed your game! It's kinda like an action game mixed with a puzzle game, and I think it fits the theme very well. There were a few levels that were extremely challenging because there were multiple sources of water and you only had a small amount of ammunition. Overall I think this is a very unique game and would love to see how it would play if you continued development on it. Congratulations on making a game in 48 hours!","love":0,"timestamp":"9/1/2018, 18:39:15","ago":"2 years ago"},{"id":273668,"parent":0,"node":106779,"supernode":97793,"author":51017,"created":"2018-09-01T18:34:39Z","modified":"2018-09-01T18:34:39Z","version":305762,"flags":0,"body":"Dude I have very good time with this one, it is really challenging game and it is fun. Slime spreding has awesome mechanics. Dude I enjoyed it so much. And it looks like you are primary programer guy. ;)","love":0,"timestamp":"9/1/2018, 20:34:39","ago":"2 years ago"},{"id":273673,"parent":0,"node":106779,"supernode":97793,"author":8809,"created":"2018-09-01T18:42:53Z","modified":"2018-09-01T18:42:53Z","version":305767,"flags":0,"body":"I tried the mac version. For some reason when I used TNT on the second level the game would crash. Not sure why. I'd be interested to hear your thoughts on how it was working on this idea. The game I worked on is a bit similar and we had a hard time getting mechanics that seemed interesting.","love":0,"timestamp":"9/1/2018, 20:42:53","ago":"2 years ago"},{"id":273690,"parent":0,"node":106779,"supernode":97793,"author":101243,"created":"2018-09-01T19:06:18Z","modified":"2018-09-01T19:06:18Z","version":305785,"flags":0,"body":"Nice game, one of the funniest that I played. Well finished and challenging, very good job!!","love":0,"timestamp":"9/1/2018, 21:06:18","ago":"2 years ago"},{"id":273704,"parent":0,"node":106779,"supernode":97793,"author":91733,"created":"2018-09-01T19:36:36Z","modified":"2018-09-01T19:36:36Z","version":305800,"flags":0,"body":"I liked UI, it's clear management.\nA good idea. Try a variety with different types of obstacles","love":0,"timestamp":"9/1/2018, 21:36:36","ago":"2 years ago"},{"id":273884,"parent":0,"node":106779,"supernode":97793,"author":103214,"created":"2018-09-02T00:02:01Z","modified":"2018-09-02T00:02:01Z","version":305991,"flags":0,"body":"Your game is very nice to play. The general impact is positive. \nAs a professional game dev I would suggest... just kidding haha\nNonetheless, if you want to work on this project more I suggest making a difficulty incresing algorithm.\nGraphics - very nice. Controls are also working very well.\nMaybe you could also take a glimpse at my game? I already enlarged it into a wholesome Android game :)","love":0,"timestamp":"9/2/2018, 02:02:01","ago":"2 years ago"},{"id":273958,"parent":0,"node":106779,"supernode":97793,"author":36660,"created":"2018-09-02T01:33:03Z","modified":"2018-09-02T01:33:03Z","version":306065,"flags":0,"body":"Noice game","love":0,"timestamp":"9/2/2018, 03:33:03","ago":"2 years ago"},{"id":274131,"parent":0,"node":106779,"supernode":97793,"author":13558,"created":"2018-09-02T14:26:23Z","modified":"2018-09-02T14:26:23Z","version":306249,"flags":0,"body":"I thought the idea was interesting and fun. I did get a bit annoyed at dying all the time though XD","love":0,"timestamp":"9/2/2018, 16:26:23","ago":"2 years ago"},{"id":274297,"parent":0,"node":106779,"supernode":97793,"author":562,"created":"2018-09-02T18:41:06Z","modified":"2018-09-02T18:41:06Z","version":306425,"flags":0,"body":"Interesting game. I included it in my compilation video series of the Ludum Dare 42 compilation video series, if youâ€™d like to take a look. :) https://youtu.be/WOSoM8jnjZc","love":0,"timestamp":"9/2/2018, 20:41:06","ago":"2 years ago"}],"event":{"id":97793,"parent":9,"superparent":5,"author":11,"type":"event","subtype":"ld","subsubtype":"","published":"2018-07-05T17:29:28Z","created":"2018-07-05T17:29:28Z","modified":"2018-08-10T21:44:37Z","version":304652,"slug":"42","name":"Ludum Dare 42","body":"Join us for Ludum Dare **42**, our August/middle-year event. :sun_with_face:\n\n**IMPORTANT SPECIAL EVENT**: Hey LD fans! As a test we are starting and ending this event **3 hours earlier** than usual. This is just an experiment. We'll be doing a survey after the event to see what people think about this. \n\n**Details**: [feedback-start-time-change-for-augusts-ldjam-event](https://ldjam.com/events/ludum-dare/41/$73264/feedback-start-time-change-for-augusts-ldjam-event)\n\nFollow the **[/news](/news)** for the latest updates on the event.\n\n* :closed_book: **Rules**: [/ludum-dare/rules](/events/ludum-dare/rules)\n* :green_book: **Game Hosting Guide**: [/ludum-dare/hosting-guide](/events/ludum-dare/hosting-guide)\n* :tv: **Keynote**: [ Hosted by Jesse Freeman](/events/ludum-dare/42/$97794/welcome-to-ludum-dare-42-special-time-3-hours-early)\n","meta":{"can-grade":"0","can-publish":"1","can-theme":"1","event-end":"2018-08-13T22:00:00Z","event-finished":"1","event-group-closed-1":"1","event-group-closed-2":"1","event-group-name-1":"Jam","event-group-name-2":"Compo","event-group-slug-1":"jam","event-group-slug-2":"compo","event-start":"2018-08-10T22:00:00Z","event-theme":"Running out of space","grade-01":"Overall","grade-02":"Fun","grade-03":"Innovation","grade-04":"Theme","grade-05":"Graphics","grade-05-optional":"1","grade-06":"Audio","grade-06-optional":"1","grade-07":"Humor","grade-07-optional":"1","grade-08":"Mood","grade-08-optional":"1","theme-idea-limit":"3","theme-mode":"8","theme-page-mode-1":"2","theme-page-mode-2":"2","theme-page-mode-3":"2","theme-page-mode-4":"2","theme-page-name-4":"Final Round"},"path":"/events/ludum-dare/42","parents":[1,5,9],"love":0,"timestamp":"7/5/2018, 19:29:28","ago":"2 years ago"},"results":[{"title":"Overall","average":3.587,"result":226},{"title":"Fun","average":3.543,"result":195},{"title":"Innovation","average":3.522,"result":183},{"title":"Theme","average":3.739,"result":272},{"title":"Graphics","average":2.913,"result":499},{"title":"Audio","average":3.413,"result":156},{"title":"Humor","average":"-","result":"-"},{"title":"Mood","average":3.522,"result":117}],"released":"2018.08.13 12:44:37","timestamp":"8/12/2018, 23:44:37","ago":"2 years ago","coverColors":{"colors":[[68,187,92,255],[164,147,85,255],[164,187,212,255],[84,88,64,255],[109,186,144,255]],"css":"--one: rgba(68,187,92,255);--two: rgba(164,147,85,255);--three: rgba(164,187,212,255);--four: rgba(84,88,64,255);--five: rgba(109,186,144,255);"}},{"id":82865,"parent":73256,"superparent":9,"author":214,"type":"item","subtype":"game","subsubtype":"compo","published":"2018-04-22T20:33:34Z","created":"2018-04-20T14:06:12Z","modified":"2018-04-22T20:34:03Z","version":244050,"slug":"drive-or-die","name":"Drive or Die","body":"![nicegame.png](ludum-dare/41/drive-or-die/images/1031a.png)\n\nDrive fast and rob banks.\n\n## Keys\n| Key(s)            | Action        |\n| ----------------- |:-------------:|\n| Arrows / WASD     | Drive         | \n| Esc               | Pause         |\n| Spacebar          | Brake         |\n| Left Mouse button | Shoot         |\n","meta":{"author":[214],"cover":"///content/6d/z/10313.png","allow-anonymous-comments":"1","link-01":"https://github.com/bradur/LD41","link-02":"https://github.com/bradur/LD41/releases/download/Compo-version/DriveOrDie.zip","link-02-tag":"42337","link-01-tag":"42337","link-03":"https://bradur.github.io/LD41/","link-03-tag":"42336"},"path":"/events/ludum-dare/41/drive-or-die","parents":[1,5,9,73256],"love":0,"notes":8,"notes-timestamp":"2018-05-11T20:51:35Z","grade":{"grade-01":22,"grade-02":22,"grade-03":22,"grade-04":22,"grade-05":22,"grade-06":19,"grade-07":19,"grade-08":21},"magic":{"cool":0,"feedback":0,"given":0,"grade":21.125,"grade-01-average":2.775,"grade-01-result":636,"grade-02-average":2.65,"grade-02-result":617,"grade-03-average":2.675,"grade-03-result":627,"grade-04-average":3,"grade-04-result":587,"grade-05-average":2.4,"grade-05-result":636,"grade-06-average":2.5,"grade-06-result":445,"grade-07-average":2.324,"grade-07-result":449,"grade-08-average":2.474,"grade-08-result":585,"smart":-78.740239861891},"eventName":"Ludum Dare 41","cover":"ludum-dare/41/drive-or-die/images/10313.png","url":"games/ludum-dare/41/drive-or-die","links":[{"url":"https://ldjam.com/events/ludum-dare/41/drive-or-die","title":"LDJam page"},{"url":"https://github.com/bradur/LD41","title":"Microsoft Windows"},{"url":"https://github.com/bradur/LD41/releases/download/Compo-version/DriveOrDie.zip","title":"Microsoft Windows"},{"url":"https://bradur.github.io/LD41/","title":"HTML5 (web)"}],"comments":[{"id":153156,"parent":0,"node":82865,"supernode":73256,"author":3475,"created":"2018-04-23T02:06:38Z","modified":"2018-04-23T02:06:38Z","version":172388,"flags":0,"body":"Finished the first level with <1 second left! Definitely got pretty tense near the end. haha","love":0,"timestamp":"4/23/2018, 04:06:38","ago":"2 years ago"},{"id":153235,"parent":0,"node":82865,"supernode":73256,"author":74458,"created":"2018-04-23T02:19:55Z","modified":"2018-04-23T02:19:55Z","version":172471,"flags":0,"body":"A bit of feedback:\n- The car drifts a bit too much, it feels more like a block of ice, haha\n- Enemies give no indication of where they are coming from and spawn it at weird intervals, making the 1st person pretty annoying. They should come from around buildings (walking before shooting) or have sounds/particle effects when spawning to help guide the player to where they are\n- The Minimap is great ðŸ‘\n- The road should be raised just a hair above the grass to remove the black clipping lines where the objects overlap","love":1,"love-timestamp":"2018-05-11T20:40:49Z","timestamp":"4/23/2018, 04:19:55","ago":"2 years ago"},{"id":153338,"parent":0,"node":82865,"supernode":73256,"author":34988,"created":"2018-04-23T02:37:37Z","modified":"2018-04-23T02:37:37Z","version":172580,"flags":0,"body":"I wanted to go a lot faster than I was. Wasn't really sure where to go either. It was fun though. Enjoyed it for a couple minutes.","love":0,"timestamp":"4/23/2018, 04:37:37","ago":"2 years ago"},{"id":184079,"parent":0,"node":82865,"supernode":73256,"author":5112,"created":"2018-04-26T02:46:41Z","modified":"2018-04-26T02:46:41Z","version":206564,"flags":0,"body":"So much drift. The concept was interesting and its too bad the driving part made it kind of not fun. Still it was kind of fun. Good work.","love":0,"timestamp":"4/26/2018, 04:46:41","ago":"2 years ago"},{"id":206181,"parent":0,"node":82865,"supernode":73256,"author":19735,"created":"2018-05-11T07:44:40Z","modified":"2018-05-11T07:44:40Z","version":231159,"flags":0,"body":"Good minimap!  ","love":0,"timestamp":"5/11/2018, 09:44:40","ago":"2 years ago"},{"id":206427,"parent":0,"node":82865,"supernode":73256,"author":9823,"created":"2018-05-11T20:16:47Z","modified":"2018-05-11T20:16:47Z","version":231431,"flags":0,"body":"Generally a really nice idea. Graphics were ok, but the steering felt a little too sensitive. Minimap really did it's job!","love":0,"timestamp":"5/11/2018, 22:16:47","ago":"2 years ago"},{"id":206434,"parent":0,"node":82865,"supernode":73256,"author":49479,"created":"2018-05-11T20:22:37Z","modified":"2018-05-11T20:22:37Z","version":231438,"flags":0,"body":"The concept is nice, though the enemy spawns were a bit annoying. Good job :)","love":0,"timestamp":"5/11/2018, 22:22:37","ago":"2 years ago"},{"id":206444,"parent":0,"node":82865,"supernode":73256,"author":6459,"created":"2018-05-11T20:51:35Z","modified":"2018-05-11T20:51:35Z","version":231448,"flags":0,"body":"As others have said, the driving model in this game really breaks it. Turning is way too slow and there is not enough friction. It's difficult enough to drive down a straight road; making a turn without veering off into the grass is basically impossible.\n\nI got through the first two levels with barely enough time left on the clock, but the third seemed like I had to know the map well to actually beat it, since there's branching paths that aren't all visible on the minimap.\n\nI really like the transition animation between the driving and the shooting.\n\nShooting didn't have much weight to it, I just had to locate and click on all the enemies. I wonder if a little bit of kickback on the player camera, or a more visceral death animation would help this section.\n\nI think the driving music was a bit too aggressive and sine-y and grated on me a little after a few levels. The shooting music tones down the frustrating bits so I enjoyed that a lot more. Oh, and it's rare to see a LD game with multiple music tracks so nice work there, and with the transition.\n\nOverall, this game feels like it just needed a lot more love put into its core mechanics (the driving and shooting models), maybe at the cost of the maps and objectives being less fleshed-out, or fewer levels. I know I've made the same mistake myself sometimes, prioritizing content without a good baseline mechanic. Maybe keep that in mind next LD.","love":1,"love-timestamp":"2018-05-12T04:26:53Z","timestamp":"5/11/2018, 22:51:35","ago":"2 years ago"}],"event":{"id":73256,"parent":9,"superparent":5,"author":11,"type":"event","subtype":"ld","subsubtype":"","published":"2018-03-15T01:50:26Z","created":"2018-03-15T01:50:26Z","modified":"2018-04-19T16:41:16Z","version":226293,"slug":"41","name":"Ludum Dare 41","body":"Join us for the **41st** Ludum Dare! Our first event of 2018! Ludum Dare year 16. :smile:\n\nFollow the **[/news](/news)** for the latest updates on the event.\n\n* :closed_book: **Rules**: [/ludum-dare/rules](/events/ludum-dare/rules)\n* :green_book: **Game Hosting Guide**: [/ludum-dare/hosting-guide](/events/ludum-dare/hosting-guide)\n* :earth_americas: **Real World Gatherings**: [/ludum-dare/41/$73264/real-world-gatherings-for-ludum-dare-41](/events/ludum-dare/41/$73264/real-world-gatherings-for-ludum-dare-41)\n* :tv: **Keynote**: [/welcome-to-ludum-dare-41](/events/ludum-dare/41/$73264/welcome-to-ludum-dare-41)\n\n## Promos\n* Free **[GameMaker Studio 2](https://ldjam.com/events/ludum-dare/41/$73264/promo-free-gamemaker-studio-2-for-ld41)** (Good until Wednesday April 25th)","meta":{"theme-idea-limit":"3","theme-mode":"8","event-start":"2018-04-21T01:00:00Z","event-end":"2018-04-24T01:00:00Z","can-theme":"1","can-publish":"1","can-grade":"0","event-finished":"1","event-theme":"Combine 2 Incompatible Genres","event-group-slug-1":"jam","event-group-slug-2":"compo","event-group-name-1":"Jam","event-group-name-2":"Compo","grade-01":"Overall","grade-02":"Fun","grade-03":"Innovation","grade-04":"Theme","grade-05":"Graphics","grade-06":"Audio","grade-07":"Humor","grade-08":"Mood","grade-05-optional":"1","grade-06-optional":"1","grade-07-optional":"1","grade-08-optional":"1","theme-page-mode-1":"2","theme-page-mode-2":"2","theme-page-mode-3":"2","theme-page-mode-4":"2","theme-page-name-4":"Final Round","event-group-closed-1":"0","event-group-closed-2":"0"},"path":"/events/ludum-dare/41","parents":[1,5,9],"love":0,"timestamp":"3/15/2018, 03:50:26","ago":"2 years ago"},"results":[{"title":"Overall","average":2.775,"result":636},{"title":"Fun","average":2.65,"result":617},{"title":"Innovation","average":2.675,"result":627},{"title":"Theme","average":3,"result":587},{"title":"Graphics","average":2.4,"result":636},{"title":"Audio","average":2.5,"result":445},{"title":"Humor","average":2.324,"result":449},{"title":"Mood","average":2.474,"result":585}],"released":"2018.04.22 11:33:34","timestamp":"4/22/2018, 22:33:34","ago":"2 years ago","coverColors":{"colors":[[87,175,104,255],[193,194,194,255],[53,64,80,255],[95,107,132,255],[164,172,195,255]],"css":"--one: rgba(87,175,104,255);--two: rgba(193,194,194,255);--three: rgba(53,64,80,255);--four: rgba(95,107,132,255);--five: rgba(164,172,195,255);"}},{"id":60803,"parent":49883,"superparent":9,"author":214,"type":"item","subtype":"game","subsubtype":"compo","published":"2017-12-04T00:19:09Z","created":"2017-12-02T02:19:41Z","modified":"2017-12-05T08:12:41Z","version":195100,"slug":"being-plundered","name":"Being Plundered","body":"![mini2.png](ludum-dare/40/being-plundered/images/a90f.png)\n\nIn *Being Plundered*, you are a hard-working asteroid miner who dreams of rich life. Yet every time you get closer to your dreams, those damn space pirates show up and force you to spend your money on repairs.\n\nReach your dream goal of $100000 by mining asteroids and selling the ore, but watch out for the pirates!\nThe more ore and money you have, the more pirates there will be!\n\n**WEBGL BUILD**: https://bradur.github.io/LD40/\n\n## Keys\n### Everywhere\n| Key(s)        | Action        |\n| ------------- |:-------------:|\n| Arrows / WASD | Movement      | \n| Esc / Z       | Pause         |\n| Alt / B       | Toggle radar  |\n| P             | Toggle music  |\n| O             | Toggle sfx    |\n\n### Only outside the space station\n| Key(s)        | Action        |\n| ------------- |:-------------:|\n| Space / Q     | Shoot cannon  | \n| Ctrl /  E     | Fire laser    |\n\n### Only in a shop\n| Key(s)        | Action        |\n| ------------- |:-------------:|\n| Enter         | Buy / Sell    | \n\n## Tips\n- Use the laser on an asteroid. The asteroid will blow up eventually, netting you some ore!\n- When away from the space station, the green arrow points towards it\n- A good way to kite the pirates is to go backwards and shoot\n- Fire the laser AND the cannon at the same time when fighting pirates!\n- Use the radar!\n- Moving in the space station doesn't consume fuel\n- Pirates cannot into space (station)\n\n## Build info\n- I have only tested the WebGL & Windows builds\n\n## Tools\n- Unity3D & Visual Studio Community\n- LMMS for music & sfx\n- Paint.NET\n\n## Screenshots\n![Warping in](ludum-dare/40/being-plundered/images/a81a.png)\n\n![Pirates Galore](ludum-dare/40/being-plundered/images/a817.png)\n\n![Mining](ludum-dare/40/being-plundered/images/a85d.png)\n\n","meta":{"author":[214],"cover":"///content/6d/z/a80e.png","link-01":"https://github.com/bradur/LD40","link-02":"https://bradur.github.io/LD40/","link-02-tag":"42336","link-03":"https://github.com/bradur/LD40/releases/download/Compo/BeingPlundered_Windows_LD40.zip","link-03-tag":"42337","link-04":"https://github.com/bradur/LD40/releases/download/Compo/BeingPlundered_Mac_LD40.app.zip","link-04-tag":"42339","link-05":"https://github.com/bradur/LD40/releases/download/Compo/BeingPlundered_Linux_LD40.zip","link-05-tag":"42341","allow-anonymous-comments":"1"},"path":"/events/ludum-dare/40/being-plundered","parents":[1,5,9,49883],"love":0,"notes":32,"notes-timestamp":"2017-12-28T11:55:31Z","grade":{"grade-01":44,"grade-02":44,"grade-03":44,"grade-04":44,"grade-05":44,"grade-06":43,"grade-07":36,"grade-08":42},"magic":{"cool":95.38919802105,"feedback":46,"given":37.875,"grade":42.625,"grade-01-average":3.881,"grade-01-result":72,"grade-02-average":3.774,"grade-02-result":106,"grade-03-average":3.357,"grade-03-result":248,"grade-04-average":3.643,"grade-04-result":236,"grade-05-average":3.857,"grade-05-result":131,"grade-06-average":3.988,"grade-06-result":27,"grade-07-average":2.632,"grade-07-result":341,"grade-08-average":3.738,"grade-08-result":63,"smart":18.127705166035},"eventName":"Ludum Dare 40","cover":"ludum-dare/40/being-plundered/images/a80e.png","url":"games/ludum-dare/40/being-plundered","links":[{"url":"https://ldjam.com/events/ludum-dare/40/being-plundered","title":"LDJam page"},{"url":"https://github.com/bradur/LD40","title":"Source"},{"url":"https://bradur.github.io/LD40/","title":"HTML5 (web)"},{"url":"https://github.com/bradur/LD40/releases/download/Compo/BeingPlundered_Windows_LD40.zip","title":"Microsoft Windows"},{"url":"https://github.com/bradur/LD40/releases/download/Compo/BeingPlundered_Mac_LD40.app.zip","title":"Apple macOS"},{"url":"https://github.com/bradur/LD40/releases/download/Compo/BeingPlundered_Linux_LD40.zip","title":"Linux"}],"comments":[{"id":98973,"parent":0,"node":60803,"supernode":49883,"author":12229,"created":"2017-12-04T17:27:18Z","modified":"2017-12-04T17:27:18Z","version":112247,"flags":0,"body":"oh, this is my favorite game on this jam! cool music, beautiful graphics, interesting gameplay. thank u, dev :rocket:","love":1,"love-timestamp":"2017-12-04T21:41:26Z","timestamp":"12/4/2017, 19:27:18","ago":"2 years ago"},{"id":99080,"parent":0,"node":60803,"supernode":49883,"author":55530,"created":"2017-12-04T17:40:41Z","modified":"2017-12-04T17:40:41Z","version":112360,"flags":0,"body":"Well done on the music. This is one of my highest-rated by mood.","love":1,"love-timestamp":"2017-12-07T19:22:53Z","timestamp":"12/4/2017, 19:40:41","ago":"2 years ago"},{"id":99662,"parent":0,"node":60803,"supernode":49883,"author":1807,"created":"2017-12-04T18:56:00Z","modified":"2017-12-04T18:56:00Z","version":112988,"flags":0,"body":"Love this. Very well made game in all aspects (gameplay, graphics, audio). Had to check if it is a Compo entry :)","love":1,"love-timestamp":"2017-12-07T19:22:50Z","timestamp":"12/4/2017, 20:56:00","ago":"2 years ago"},{"id":99921,"parent":0,"node":60803,"supernode":49883,"author":171,"created":"2017-12-04T19:29:18Z","modified":"2017-12-04T19:29:18Z","version":113265,"flags":0,"body":"Love the songs! I really enjoyed flying the ship, really my kind of game (look at my entry!) with physics-based control.","love":1,"love-timestamp":"2017-12-07T19:22:54Z","timestamp":"12/4/2017, 21:29:18","ago":"2 years ago"},{"id":100229,"parent":0,"node":60803,"supernode":49883,"author":6938,"created":"2017-12-04T20:06:53Z","modified":"2017-12-04T20:06:53Z","version":113602,"flags":0,"body":"Whaow this game feels so complete. I mean gameplay itself is pretty good and entertaining but little things like music change on 'safe zone', how pirates warp in after you destroy asteroids and movement in generals feels so smooth. This game feels really polished, most impressing for 48 hours. Well done, well done.","love":1,"love-timestamp":"2017-12-07T19:22:49Z","timestamp":"12/4/2017, 22:06:53","ago":"2 years ago"},{"id":100230,"parent":0,"node":60803,"supernode":49883,"author":10334,"created":"2017-12-04T20:06:56Z","modified":"2017-12-04T20:06:56Z","version":113603,"flags":0,"body":"Fun game - I got so close to winning but the pirates overwhelmed me. (97k and 1 asteroid very close to base) Liked the music and graphics quite a bit. Thanks for a fun game.","love":1,"love-timestamp":"2017-12-07T19:22:49Z","timestamp":"12/4/2017, 22:06:56","ago":"2 years ago"},{"id":101760,"parent":0,"node":60803,"supernode":49883,"author":49859,"created":"2017-12-04T23:22:54Z","modified":"2017-12-04T23:22:54Z","version":115315,"flags":0,"body":"Really love your game! Its inovative and pretty fun","love":1,"love-timestamp":"2017-12-07T19:22:49Z","timestamp":"12/5/2017, 01:22:54","ago":"2 years ago"},{"id":106211,"parent":0,"node":60803,"supernode":49883,"author":45158,"created":"2017-12-05T08:28:59Z","modified":"2017-12-05T08:28:59Z","version":120193,"flags":0,"body":"Hey, you weren't kidding about similar ideas! Yours is definitely WAAAY more polished than mine, however, but you've very much made a game right in line with what I was hoping for with mine. Feels complete, the refueling/repair station is great, and it's surprising relaxing (not something I had in mind for mine, heh).  \n\nSuper slick. Congrats!","love":1,"love-timestamp":"2017-12-07T19:22:48Z","timestamp":"12/5/2017, 10:28:59","ago":"2 years ago"},{"id":106684,"parent":0,"node":60803,"supernode":49883,"author":6205,"created":"2017-12-05T09:48:49Z","modified":"2017-12-05T09:48:49Z","version":120711,"flags":0,"body":"Nice game. Like the buying options. Combat could use some more explosions and stuff. Also the music was very nice.","love":1,"love-timestamp":"2017-12-07T19:22:47Z","timestamp":"12/5/2017, 11:48:49","ago":"2 years ago"},{"id":106844,"parent":0,"node":60803,"supernode":49883,"author":35836,"created":"2017-12-05T10:14:47Z","modified":"2017-12-05T10:14:47Z","version":120877,"flags":0,"body":"really good game, love the music!","love":1,"love-timestamp":"2017-12-07T19:22:47Z","timestamp":"12/5/2017, 12:14:47","ago":"2 years ago"},{"id":108182,"parent":0,"node":60803,"supernode":49883,"author":9746,"created":"2017-12-05T13:13:44Z","modified":"2017-12-05T13:13:44Z","version":122337,"flags":0,"body":"Really like the music and was a lot of fun. ","love":1,"love-timestamp":"2017-12-07T19:22:46Z","timestamp":"12/5/2017, 15:13:44","ago":"2 years ago"},{"id":110258,"parent":0,"node":60803,"supernode":49883,"author":444,"created":"2017-12-05T16:22:54Z","modified":"2017-12-05T16:22:54Z","version":124624,"flags":0,"body":"It has a good amount of content for something made in 48 hours. I just recommend changing the controls of the web version (not that you could change them anymore, though), for example pressing Ctrl and Space takes me to the starting page in Opera, and Alt opens a menu.","love":1,"love-timestamp":"2017-12-07T19:22:45Z","timestamp":"12/5/2017, 18:22:54","ago":"2 years ago"},{"id":110700,"parent":0,"node":60803,"supernode":49883,"author":58312,"created":"2017-12-05T16:59:03Z","modified":"2017-12-05T16:59:03Z","version":125111,"flags":0,"body":"the best game  i played till now. the music and mood are perfect","love":1,"love-timestamp":"2017-12-07T19:22:45Z","timestamp":"12/5/2017, 18:59:03","ago":"2 years ago"},{"id":110902,"parent":0,"node":60803,"supernode":49883,"author":9947,"created":"2017-12-05T17:16:29Z","modified":"2017-12-05T17:16:29Z","version":125332,"flags":0,"body":"This. Is. Amazing. I love it!\n\n# Good stuff:\n\n- It's got so many small details, like the warping-in animation that the pirates do, and the little maneuvering thrusters when turning.\n- I love the music and sound effects.\n- Graphics are great too - I really like the style.\n\n# Bad stuff:\n\n- I feel like there's way too much drag inside the space station. It's really hard to move in there.\n- There doesn't seem to be any damage when you hit something, which makes 'crash into stuff to save fuel when slowing down' a valid tactic.\n","love":1,"love-timestamp":"2017-12-07T19:22:33Z","timestamp":"12/5/2017, 19:16:29","ago":"2 years ago"},{"id":118293,"parent":0,"node":60803,"supernode":49883,"author":67938,"created":"2017-12-06T06:11:31Z","modified":"2017-12-06T06:11:31Z","version":133349,"flags":0,"body":"Wowww this is solid. I love the slowing down near the power ups like it's a space station. I like the bounce back on the purple gaseous boundary of space. I like the space ships, rather intimidating but as long as you don't freeze up like a deer in headlights you can take them rope-a-dope style strafe maneuver. I'm gonna keep playing! Excellent work. And nice touch allowing the player to toggle music that's thoughtful! ","love":1,"love-timestamp":"2017-12-07T19:22:44Z","timestamp":"12/6/2017, 08:11:31","ago":"2 years ago"},{"id":118466,"parent":0,"node":60803,"supernode":49883,"author":214,"created":"2017-12-06T06:47:09Z","modified":"2017-12-06T06:47:09Z","version":133533,"flags":0,"body":"Thank you everyone who played my game! I love the feedback you've given :).\n\nHey @willbl3pic thanks for the constructive criticism.\n\n- The drag inside the space station is a lot, I agree. I think I will spend some time thinking for a better solution if I continue development.\n\n- Good point about the crashing! This wouldn't be hard to add. Maybe I will :).","love":2,"love-timestamp":"2017-12-22T14:13:31Z","timestamp":"12/6/2017, 08:47:09","ago":"2 years ago"},{"id":122061,"parent":0,"node":60803,"supernode":49883,"author":562,"created":"2017-12-06T17:56:40Z","modified":"2017-12-06T17:56:40Z","version":137530,"flags":0,"body":"Very complex game! I included it in my Ludum Dare 40 compilation video series, if youâ€™d like to take a look. :) https://www.youtube.com/watch?v=CUur4iynK94","love":1,"love-timestamp":"2017-12-07T19:22:24Z","timestamp":"12/6/2017, 19:56:40","ago":"2 years ago"},{"id":123642,"parent":0,"node":60803,"supernode":49883,"author":34014,"created":"2017-12-06T21:25:35Z","modified":"2017-12-06T21:25:35Z","version":139253,"flags":0,"body":"I had a lot of fun with this game. It reminds me of [Asteroid Scavenger](https://ldjam.com/events/ludum-dare/39/asteroid-scavenger) by @blueman which was one of my favourites from LD39. Others have praised most of the things I like about Being Plundered so I won't repeat their words.\n\nI found that the best strategy is to rush out, mine an asteroid, and rush back to the station without ever interacting with the pirates at all. You can easily move faster than the pirates or their bullets so it's easiest to just never fight them :) plus you save money on repairing your ship. Early in the game I found it fun to fight the pirates (I've never seen this type of combat in a game before but I really like it) but in my pursuit of $100k it was just better to avoid them.\n\nI don't like that weird shaky effect on the background while mining, it's disorienting. I also wish that you could keep playing after reaching $100k. I was looking forward to mining every single asteroid in the whole map.\n\nSolid game, I'm really glad I played it :)","love":2,"love-timestamp":"2017-12-09T06:40:22Z","timestamp":"12/6/2017, 23:25:35","ago":"2 years ago"},{"id":124806,"parent":0,"node":60803,"supernode":49883,"author":58592,"created":"2017-12-07T00:31:06Z","modified":"2017-12-07T00:31:06Z","version":140533,"flags":0,"body":"This would go very nicely with a perhaps more advanced ship building feature (kinda like nimbatus I am imagining here)","love":1,"love-timestamp":"2017-12-07T19:22:40Z","timestamp":"12/7/2017, 02:31:06","ago":"2 years ago"},{"id":125495,"parent":0,"node":60803,"supernode":49883,"author":10321,"created":"2017-12-07T03:03:36Z","modified":"2017-12-07T03:03:36Z","version":141278,"flags":0,"body":"Nice game that fits the theme quite well. For expansion, I would have liked to seethe opportunity to upgrade my ship. After all, I am mining asteroids just to fix and fuel my ship. I'd like to be able to get a better one. Great job with the limitations, though!","love":1,"love-timestamp":"2017-12-07T19:22:39Z","timestamp":"12/7/2017, 05:03:36","ago":"2 years ago"},{"id":125539,"parent":0,"node":60803,"supernode":49883,"author":37242,"created":"2017-12-07T03:14:44Z","modified":"2017-12-07T03:14:44Z","version":141330,"flags":0,"body":"Yeeahh, made it to 100k (barely). Blocking space pirates with asteroids was a surprisingly optimal strategy. \n\nI liked the drag effect at the space station, though I'll admit it's kinda disheartening if you get shot while entering it and can't do anything. Overall, the game felt like a very complete package to me. All thumbs up!","love":1,"love-timestamp":"2017-12-07T19:22:38Z","timestamp":"12/7/2017, 05:14:44","ago":"2 years ago"},{"id":125724,"parent":0,"node":60803,"supernode":49883,"author":17363,"created":"2017-12-07T04:00:30Z","modified":"2017-12-07T04:00:30Z","version":141531,"flags":0,"body":"Thanks to @Iamsodarncool for the compliment and bringing me to this game! With a hard theme imo, it was hard to be creative, but you followed the theme well with an original idea nonetheless. The combat felt a little stiff, but the rest of the game was smooth to play. It looks nice and the music is a good addition, well made!","love":2,"love-timestamp":"2017-12-07T19:22:41Z","timestamp":"12/7/2017, 06:00:30","ago":"2 years ago"},{"id":127350,"parent":0,"node":60803,"supernode":49883,"author":1403,"created":"2017-12-07T14:12:28Z","modified":"2017-12-07T14:12:28Z","version":143322,"flags":0,"body":"I suck at this type of game, but enjoy it.\nmusic fits well and melancholic mood is great.\nNot really original but well executed!","love":1,"love-timestamp":"2017-12-07T19:22:41Z","timestamp":"12/7/2017, 16:12:28","ago":"2 years ago"},{"id":129254,"parent":0,"node":60803,"supernode":49883,"author":41592,"created":"2017-12-07T21:50:10Z","modified":"2017-12-07T21:50:11Z","version":145434,"flags":0,"body":"Never was good at asteroid game but this one was enjoyable for me. One thing I learnt: Never mine large asteroids. The music is a bliss to hear. Good Work.","love":1,"love-timestamp":"2017-12-09T06:40:21Z","timestamp":"12/7/2017, 23:50:10","ago":"2 years ago"},{"id":130516,"parent":0,"node":60803,"supernode":49883,"author":61067,"created":"2017-12-08T07:28:06Z","modified":"2017-12-08T07:28:06Z","version":146835,"flags":0,"body":"Neat game. I think this is my favorite compo game so far. The turning is a bit fast which makes movement challenging and it gets pretty hard once a ton of ships start warping in. I thought it was based on amount you were hauling but I mined a small asteroid and 5+ ships still warped in. I guess its based on the largest asteroid you mined so you should probably go in size order?","love":1,"love-timestamp":"2017-12-09T06:40:20Z","timestamp":"12/8/2017, 09:28:06","ago":"2 years ago"},{"id":130540,"parent":0,"node":60803,"supernode":49883,"author":214,"created":"2017-12-08T07:52:30Z","modified":"2017-12-08T07:52:47Z","version":146861,"flags":0,"body":"@rasm Hey thanks for playing! The amount of pirates is based on the amount of money you have & the amount of ore you have & the amount of ore you are getting from the asteroid. So if you have 10k money and 5 ore and you mine an asteroid worth of 5, you get (10 + 5 + 5 / 10) = 2 pirates.\n","love":1,"love-timestamp":"2017-12-09T06:40:19Z","timestamp":"12/8/2017, 09:52:30","ago":"2 years ago"},{"id":130545,"parent":0,"node":60803,"supernode":49883,"author":53524,"created":"2017-12-08T07:58:46Z","modified":"2017-12-08T07:58:46Z","version":146865,"flags":0,"body":"Very nice game! At first I felt that there is quite a lot of things to learn but as soon as I learned the basics I really enjoyed the game. I even managed to reach 100000$. :slight_smile: Maybe the AI of the pirates could have been more sophisticated (for example anticipating the direction I am flying) and controlling the spaceship was a bit sluggish. However, the overall design and implementation is very good! :slight_smile:","love":1,"love-timestamp":"2017-12-09T06:40:18Z","timestamp":"12/8/2017, 09:58:46","ago":"2 years ago"},{"id":130613,"parent":0,"node":60803,"supernode":49883,"author":7555,"created":"2017-12-08T09:02:49Z","modified":"2017-12-08T09:03:03Z","version":146944,"flags":0,"body":"Hey, cool game here, mining asteroids with lazers is always great. The pirates arrival animation is a nice touch. It was fun to play it. Only wish speed around station was a bit faster.","love":1,"love-timestamp":"2017-12-09T06:40:18Z","timestamp":"12/8/2017, 11:02:49","ago":"2 years ago"},{"id":132797,"parent":0,"node":60803,"supernode":49883,"author":454,"created":"2017-12-09T02:17:20Z","modified":"2017-12-09T02:17:20Z","version":149400,"flags":0,"body":"I loved the art and the music. The controls are tricky, but I like the idea a lot. We played your game on our Twitch stream. There will be a video of it posted on our Youtube channel: https://www.youtube.com/channel/UCW4XMpP2tKwBCS5NEgPGbhA?","love":1,"love-timestamp":"2017-12-09T06:40:17Z","timestamp":"12/9/2017, 04:17:20","ago":"2 years ago"},{"id":137056,"parent":0,"node":60803,"supernode":49883,"author":52870,"created":"2017-12-10T21:49:06Z","modified":"2017-12-10T21:49:06Z","version":154192,"flags":0,"body":"Really solid effort. Everything works and feels solid in its execution. I am an asteroids hater, but this kept me playing way longer than most would. Pleasant experience all round. If you are still in the market for playing games I still need some ratings to get my 20. Run Guys could do with a little help! Thanks","love":1,"love-timestamp":"2017-12-26T13:39:18Z","timestamp":"12/10/2017, 23:49:06","ago":"2 years ago"},{"id":142580,"parent":0,"node":60803,"supernode":49883,"author":3904,"created":"2017-12-16T11:48:50Z","modified":"2017-12-16T11:48:50Z","version":160334,"flags":0,"body":"I really enjoy the mix of relaxing grunt-work and action-packed gunfights. Dynamic music could really take this somewhere.\n\nWhat I'm having most problems with is what to do when those pesky pirates follow me back to base. \n\n![how-to-get-out 2017-12-16 kl. 12.41.26.png](ludum-dare/40/being-plundered/images/e9e0.png)\n\nCant really find a good way to break out of this situation since I cant fire the guns from inside the shield.\n\nSpeaking of the home base, using different docking stations for different purposes (sell ore, refill fuel, repair ship) is a really nice touch.","love":1,"love-timestamp":"2017-12-26T13:39:20Z","timestamp":"12/16/2017, 13:48:50","ago":"2 years ago"},{"id":148211,"parent":0,"node":60803,"supernode":49883,"author":173,"created":"2017-12-28T11:55:31Z","modified":"2017-12-28T11:55:31Z","version":166767,"flags":0,"body":"This game has so much polish and features for a compo entry it's sick. Great mechanics and stuff.","love":1,"love-timestamp":"2017-12-28T12:20:06Z","timestamp":"12/28/2017, 13:55:31","ago":"2 years ago"}],"event":{"id":49883,"parent":9,"superparent":5,"author":11,"type":"event","subtype":"ld","subsubtype":"","published":"2017-11-03T19:59:34Z","created":"2017-11-03T19:59:34Z","modified":"2017-11-30T17:16:41Z","version":152300,"slug":"40","name":"Ludum Dare 40","body":"Join us for the **40th** Ludum Dare! We're sticking to a classic LD. That's a **72 hour Jam** and **48 hour Compo**. \n\nWhat's new:\n\n* Notifications\n* Anonymous Comments\n* Half-star ratings\n* Charts\n* Website Performance Fixes\n* And more!\n\nBig thanks to @sgstair, @local-minimum, @zwrawr, and @noojuno for their help!\n\nFollow the **[/news](/news)** for the latest updates on the event.\n\n* :closed_book: **Rules:** [/ludum-dare/rules](/events/ludum-dare/rules)\n* :green_book: **Game Hosting Guide:** [/ludum-dare/hosting-guide](/events/ludum-dare/hosting-guide)\n* :earth_americas: **Real World Gatherings:** [/ludum-dare/40/.../real-world-gatherings](/events/ludum-dare/40/$49884/real-world-gatherings-for-ludum-dare-40)\n* :tv: **Keynote:** [/ludum-dare/40/.../welcome-to-ludum-dare-40](/events/ludum-dare/40/$49884/welcome-to-ludum-dare-40)","meta":{"event-start":"2017-12-02T02:00:00Z","event-end":"2017-12-05T02:00:00Z","event-group-slug-1":"jam","event-group-slug-2":"compo","event-group-name-1":"Jam","event-group-name-2":"Compo","can-theme":"1","theme-mode":"8","grade-01":"Overall","grade-02":"Fun","grade-03":"Innovation","grade-04":"Theme","grade-05":"Graphics","grade-06":"Audio","grade-07":"Humor","grade-08":"Mood","grade-05-optional":"1","grade-06-optional":"1","grade-07-optional":"1","grade-08-optional":"1","theme-page-mode-1":"2","theme-page-mode-2":"2","theme-page-mode-3":"2","theme-page-mode-4":"2","theme-page-name-4":"Final Round","event-theme":"The more you have, the worse it is","can-publish":"1","can-grade":"0","event-finished":"1","theme-idea-limit":"3"},"path":"/events/ludum-dare/40","parents":[1,5,9],"love":0,"timestamp":"11/3/2017, 21:59:34","ago":"2 years ago"},"results":[{"title":"Overall","average":3.881,"result":72},{"title":"Fun","average":3.774,"result":106},{"title":"Innovation","average":3.357,"result":248},{"title":"Theme","average":3.643,"result":236},{"title":"Graphics","average":3.857,"result":131},{"title":"Audio","average":3.988,"result":27},{"title":"Humor","average":2.632,"result":341},{"title":"Mood","average":3.738,"result":63}],"released":"2017.12.04 02:19:09","timestamp":"12/4/2017, 02:19:09","ago":"2 years ago","coverColors":{"colors":[[4,16,16,255],[94,65,8,255],[65,46,8,255],[64,91,116,255],[64,70,72,255]],"css":"--one: rgba(4,16,16,255);--two: rgba(94,65,8,255);--three: rgba(65,46,8,255);--four: rgba(64,91,116,255);--five: rgba(64,70,72,255);"}},{"id":33150,"parent":32802,"superparent":9,"author":214,"type":"item","subtype":"game","subsubtype":"compo","published":"2017-07-31T00:25:57Z","created":"2017-07-12T13:58:31Z","modified":"2017-07-31T00:25:57Z","version":111447,"slug":"in-charge-of-power","name":"In Charge of Power","body":"**A new city has been built! But who turned off the lights?**\n\n![2017-07-31 02_56_16-Greenshot (Custom) (2).png](ludum-dare/39/in-charge-of-power/images/5e1a.png)\n\n*In Charge of Power* is a game in which you are responsible for providing electricity for a recently founded city. As the city gains more citizens, the need for electricity grows steadily. Will you be able to provide for the city, or will you run out of power and become a disappointment? See if you can help the city grow to a population of **one hundred citizens**!\n\n![2017-07-31 02_56_57-Greenshot (Custom) (2).png](ludum-dare/39/in-charge-of-power/images/5e1b.png)\n\n*How to play*\n1. Use your mouse to hover over things and perhaps click some of those things.\n2. The game should be able to tell you which things are worth clicking.\n3. For adventurous folks the game also reacts to scrolling of the wheel and panning of the screen.\n\n![2017-07-31 02_57_28-Greenshot (Custom) (2).png](ludum-dare/39/in-charge-of-power/images/5e26.png)\n\n*I have only tested the Windows build with these resolutions: 1280x720, 1920x1080, 2560x1440.*\n\n![2017-07-31 02_57_04-Greenshot (Custom) (2).png](ludum-dare/39/in-charge-of-power/images/5e24.png)\n\n","meta":{"cover":"///content/6d/z/5d9e.png","link-01":"https://github.com/bradur/LD39/","link-02":"https://github.com/bradur/LD39/releases/download/release/In.Charge.of.Power.-.LD39.by.bradur.Windows.zip","link-02-tag":"42337","link-03":"https://github.com/bradur/LD39/releases/download/release/In.Charge.of.Power.-.LD39.by.bradur.Mac.zip","link-03-tag":"42339","link-04":"https://github.com/bradur/LD39/releases/download/release/In.Charge.of.Power.-.LD39.by.bradur.Mac.zip","link-04-tag":"42341","author":[214]},"path":"/events/ludum-dare/39/in-charge-of-power","parents":[1,5,9,32802],"love":0,"notes":3,"notes-timestamp":"2017-08-21T11:45:20Z","grade":{"grade-01":3,"grade-02":3,"grade-03":3,"grade-04":3,"grade-05":3,"grade-06":3,"grade-07":3,"grade-08":3},"magic":{"cool":0,"feedback":0,"given":0,"grade":3,"grade-01-average":3,"grade-02-average":3,"grade-03-average":3,"grade-04-average":3,"grade-05-average":3,"grade-06-average":3,"grade-07-average":2,"grade-08-average":3,"smart":-42.264973081037},"eventName":"Ludum Dare 39","cover":"ludum-dare/39/in-charge-of-power/images/5d9e.png","url":"games/ludum-dare/39/in-charge-of-power","links":[{"url":"https://ldjam.com/events/ludum-dare/39/in-charge-of-power","title":"LDJam page"},{"url":"https://github.com/bradur/LD39/","title":"Source"},{"url":"https://github.com/bradur/LD39/releases/download/release/In.Charge.of.Power.-.LD39.by.bradur.Windows.zip","title":"Microsoft Windows"},{"url":"https://github.com/bradur/LD39/releases/download/release/In.Charge.of.Power.-.LD39.by.bradur.Mac.zip","title":"Apple macOS"},{"url":"https://github.com/bradur/LD39/releases/download/release/In.Charge.of.Power.-.LD39.by.bradur.Mac.zip","title":"Linux"}],"comments":[{"id":58141,"parent":0,"node":33150,"supernode":32802,"author":35298,"created":"2017-08-01T15:18:57Z","modified":"2017-08-01T15:20:12Z","version":66490,"flags":0,"body":"I think the game could do with a bit of balancing because I found it hard to get over about 20 citizens, but the game is good otherwise. \nIt might be worth adding some more ways to get money, or increasing the amount of coal a processing plant produces so it can provide for 2 coal plants.\nThe music is well made, the concept is interesting, and it's fun to replay.","love":0,"timestamp":"8/1/2017, 17:18:57","ago":"3 years ago"},{"id":77323,"parent":0,"node":33150,"supernode":32802,"author":9760,"created":"2017-08-05T15:03:13Z","modified":"2017-08-05T15:03:13Z","version":88034,"flags":0,"body":"I've always been a fan of Sim City like games so you get bonus points from me! Love the music as well, and gave the game multiple attempts. It seems to get really hard when you have 20 or so citizens. ","love":0,"timestamp":"8/5/2017, 17:03:13","ago":"3 years ago"},{"id":90429,"parent":0,"node":33150,"supernode":32802,"author":33835,"created":"2017-08-21T11:45:20Z","modified":"2017-08-21T11:45:20Z","version":102814,"flags":0,"body":"Nice game.","love":0,"timestamp":"8/21/2017, 13:45:20","ago":"3 years ago"}],"event":{"id":32802,"parent":9,"superparent":5,"author":11,"type":"event","subtype":"ld","subsubtype":"","published":"2017-07-06T16:33:09Z","created":"2017-07-06T16:33:09Z","modified":"2017-07-28T14:29:34Z","version":96562,"slug":"39","name":"Ludum Dare 39","body":"Join us for our **39th** major Ludum Dare event. Our 2nd event running on the brand new software!\n\nAgain we're sticking to a classic Ludum Dare, with a **72 hour Jam** and **48 hour Compo**. There may be some minor tweaks to the rules for improved clarity.\n\nFollow the **[/news](/news)** for the latest updates on the event.\n\n* :closed_book: **Rules:** [/ludum-dare/rules](/events/ludum-dare/rules)\n* :green_book: **Game Hosting Guide:** [/ludum-dare/hosting-guide](/events/ludum-dare/hosting-guide)\n* :earth_americas: **Real World Gatherings:** [List of Real World Gatherings (thread)](/events/ludum-dare/39/$32803/real-world-gatherings-for-ludum-dare-39)\n* :tv: **Keynote:** [Welcome to Ludum Dare 39](/events/ludum-dare/39/$32803/welcome-to-ludum-dare-39)","meta":{"event-start":"2017-07-29T01:00:00Z","event-end":"2017-08-01T01:00:00Z","can-theme":"1","theme-mode":"8","theme-page-mode-1":"2","theme-page-mode-2":"2","theme-page-mode-3":"2","theme-page-mode-4":"2","theme-page-name-4":"Final Round","event-theme":"Running out of Power","event-group-slug-1":"jam","event-group-slug-2":"compo","event-group-name-1":"Jam","event-group-name-2":"Compo","grade-01":"Overall","grade-02":"Fun","grade-03":"Innovation","grade-04":"Theme","grade-05":"Graphics","grade-06":"Audio","grade-07":"Humor","grade-08":"Mood","grade-05-optional":"1","grade-06-optional":"1","grade-07-optional":"1","grade-08-optional":"1","can-publish":"0","can-grade":"0","event-finished":"1","theme-idea-limit":"3"},"path":"/events/ludum-dare/39","parents":[1,5,9],"love":0,"timestamp":"7/6/2017, 18:33:09","ago":"3 years ago"},"results":[{"title":"Overall","average":3,"result":"-"},{"title":"Fun","average":3,"result":"-"},{"title":"Innovation","average":3,"result":"-"},{"title":"Theme","average":3,"result":"-"},{"title":"Graphics","average":3,"result":"-"},{"title":"Audio","average":3,"result":"-"},{"title":"Humor","average":2,"result":"-"},{"title":"Mood","average":3,"result":"-"}],"released":"2017.07.31 03:25:57","timestamp":"7/31/2017, 02:25:57","ago":"3 years ago","coverColors":{"colors":[[127,165,147,255],[208,206,206,255],[44,124,172,255],[5,4,4,255],[100,76,51,255]],"css":"--one: rgba(127,165,147,255);--two: rgba(208,206,206,255);--three: rgba(44,124,172,255);--four: rgba(5,4,4,255);--five: rgba(100,76,51,255);"}},{"id":15904,"parent":9405,"superparent":9,"author":214,"type":"item","subtype":"game","subsubtype":"compo","published":"2017-04-24T00:12:43Z","created":"2017-04-21T21:19:56Z","modified":"2017-04-24T00:12:43Z","version":41817,"slug":"out-of-this-small-world","name":"Out of This Small World","body":"![flippers.png](ludum-dare/38/out-of-this-small-world/images/8f1.png)\n\n**Out of This Small World** is a puzzle game, where you're on a small planet.\nYou must use the curvature of the planet to your advantage! (hint: the map loops on itself).\nStep through the portal and get Out of This Small World (just to find another one behind the portal).\n\n## Download:\n* **Windows:** https://github.com/bradur/LD38/releases/download/1.0/OutofThisSmallWorld_win.zip\n* **Max OSX:** https://github.com/bradur/LD38/releases/download/1.0/OutofThisSmallWorld_mac.zip\n* **Linux:** https://github.com/bradur/LD38/releases/download/1.0/OutofThisSmallWorld_linux.zip\n\n*Only the Windows version has been tested*\n\n*Meant to be run at a 16:9 resolution*\n\n## Keys:\n\n- Arrow Keys: Move\n- Esc: Open menu\n- (hold) Right Shift: Sprint while moving forward\n- Space: Chop tree (when equipped with an axe and targeting a tree)\n- Right Ctrl: Unlock a door (when equipped with a key and targeting a door)\n- F1: Toggle info\n- P: Mute audio\n\n## Tips:\n\n- Some switches only work once, some work endlessly\n- Axes are poorly made. They can only withstand chopping down one tree before they break!\n- If you have flippers you can walk on water (no time to implement swimming animation!).\n\n## Bugs:\n\n- The looping world was implemented very poorly. Bugs related to that are bound to happen.\n- Sometimes a tree just won't go down. Restarting the level should do the trick! (Esc and Q).\n\n## More screenshots\n![yellowkey.png](ludum-dare/38/out-of-this-small-world/images/8ed.png)\n![screen_1492988936.05.png](ludum-dare/38/out-of-this-small-world/images/8ea.png)\n\n## Links\n* **TWITTER:** https://twitter.com/bradurdung\n* **SOURCE CODE:** https://github.com/bradur/LD38","meta":{"cover":"///content/6d/z/6a38.png","author":[214]},"path":"/events/ludum-dare/38/out-of-this-small-world","parents":[1,5,9,9405],"love":0,"notes":2,"notes-timestamp":"2017-05-07T23:01:16Z","grade":{"grade-01":2,"grade-02":2,"grade-03":2,"grade-04":2,"grade-05":2,"grade-06":2,"grade-07":1,"grade-08":1},"magic":{"cool":0,"feedback":0,"given":0,"grade":1.75,"smart":-24.407105398155},"eventName":"Ludum Dare 38","cover":"ludum-dare/38/out-of-this-small-world/images/6a38.png","url":"games/ludum-dare/38/out-of-this-small-world","links":[{"url":"https://ldjam.com/events/ludum-dare/38/out-of-this-small-world","title":"LDJam page"}],"comments":[{"id":12177,"parent":0,"node":15904,"supernode":9405,"author":9853,"created":"2017-05-01T19:36:10Z","modified":"2017-05-01T19:36:10Z","version":14131,"flags":0,"body":"Fun game. The idea is nice, but the constant rotation is highly irritating. Maybe I'm getting old :)\n\nI had the bug, where a tree wouldn't vanish after being chopped.","love":0,"timestamp":"5/1/2017, 21:36:10","ago":"3 years ago"},{"id":28733,"parent":0,"node":15904,"supernode":9405,"author":13031,"created":"2017-05-07T23:01:16Z","modified":"2017-05-07T23:01:16Z","version":33189,"flags":0,"body":"I like this. I didn't have a problem with the rotation but I can understand that some might. I didn't like the fact that after teleporting I lost all my inventory - it seems a little unfair that I had to find flippers again!? Perhaps it's like The Terminator and only living flesh can teleport? :grinning:\n\nI like the music - it fits the game well. Nice work.","love":0,"timestamp":"5/8/2017, 01:01:16","ago":"3 years ago"}],"event":{"id":9405,"parent":9,"superparent":5,"author":11,"type":"event","subtype":"ld","subsubtype":"","published":"2017-03-25T10:56:44Z","created":"2017-03-25T10:56:44Z","modified":"2017-04-18T21:27:33Z","version":0,"slug":"38","name":"Ludum Dare 38","body":"Celebrating **15 years** of Ludum Dare! :cake:\r\n\r\nJoin us for our **38th** major Ludum Dare event. We're sticking to the classic Ludum Dare rules you all know and love, with a **72 hour Jam** and **48 hour Compo**. But this time, we're doing it with some brand new custom software. The software is still very-much alpha quality, but it _should_ be usable. :sweat_smile:\r\n\r\nFollow the **[/news](/news)** for the latest updates on the event.\r\n\r\n* :closed_book: **Rules:** [/ludum-dare/rules](/events/ludum-dare/rules)\r\n* :green_book: **Game Hosting Guide:** [/ludum-dare/hosting-guide](/events/ludum-dare/hosting-guide)\r\n* :earth_americas: **Real World Gatherings:** [ludumdare.com/../real-world-gatherings](http://ludumdare.com/compo/2017/04/04/real-world-gatherings-for-ludum-dare-38-placeholder/)","meta":{"event-start":"2017-04-22T01:00:00Z","theme-mode":"8","when":"April 21st-24th, 2017","theme-page-mode-1":"2","theme-page-mode-2":"2","theme-page-mode-3":"2","theme-page-name-4":"Final Round","event-theme":"A Small World","event-group-slug-1":"jam","event-group-slug-2":"compo","event-group-name-1":"Jam","event-group-name-2":"Compo","event-end":"2017-04-25T01:00:00Z","theme-page-mode-4":"2","can-theme":"1","grade-01":"Overall","grade-02":"Fun","grade-03":"Innovation","grade-04":"Theme","grade-05":"Graphics","grade-06":"Audio","grade-07":"Humor","grade-08":"Mood","grade-05-optional":"1","grade-06-optional":"1","grade-07-optional":"1","grade-08-optional":"1","can-grade":"0","event-finished":"1","theme-idea-limit":"3"},"path":"/events/ludum-dare/38","parents":[1,5,9],"love":0,"timestamp":"3/25/2017, 12:56:44","ago":"3 years ago"},"results":[{"title":"Overall","average":"-","result":"-"},{"title":"Fun","average":"-","result":"-"},{"title":"Innovation","average":"-","result":"-"},{"title":"Theme","average":"-","result":"-"},{"title":"Graphics","average":"-","result":"-"},{"title":"Audio","average":"-","result":"-"},{"title":"Humor","average":"-","result":"-"},{"title":"Mood","average":"-","result":"-"}],"released":"2017.04.24 03:12:43","timestamp":"4/24/2017, 02:12:43","ago":"3 years ago","coverColors":{"colors":[[101,81,65,255],[15,125,210,255],[239,120,103,255],[10,13,18,255],[172,180,104,255]],"css":"--one: rgba(101,81,65,255);--two: rgba(15,125,210,255);--three: rgba(239,120,103,255);--four: rgba(10,13,18,255);--five: rgba(172,180,104,255);"}}]